{"schema_version":1,"project":"private-vm","release_tag":"v0.1.0-rc.1","source_repository":"StevenBuglione/private-vm","source_commit":"cccccccccccccccccccccccccccccccccccccccc","source_ref":"refs/tags/v0.1.0-rc.1","workflow":".github/workflows/release.yml","created_at":"2026-07-19T12:00:00Z","packages":[{"kind":"deb","file":"private-vm_0.1.0-rc.1_linux_amd64.deb","size_bytes":1,"sha256":"sha256:aaaaaaaaaaaaaaaaaaaaaaaaaaaaaaaaaaaaaaaaaaaaaaaaaaaaaaaaaaaaaaaa","manifest":"deb.build-manifest.json","manifest_sha256":"sha256:bbbbbbbbbbbbbbbbbbbbbbbbbbbbbbbbbbbbbbbbbbbbbbbbbbbbbbbbbbbbbbbb","sbom":"deb.sbom.spdx.json","sbom_sha256":"sha256:cccccccccccccccccccccccccccccccccccccccccccccccccccccccccccccccc","provenance":"deb.sigstore.json"},{"kind":"rpm","file":"private-vm_0.1.0-rc.1_linux_amd64.rpm","size_bytes":1,"sha256":"sha256:aaaaaaaaaaaaaaaaaaaaaaaaaaaaaaaaaaaaaaaaaaaaaaaaaaaaaaaaaaaaaaaa","manifest":"rpm.build-manifest.json","manifest_sha256":"sha256:bbbbbbbbbbbbbbbbbbbbbbbbbbbbbbbbbbbbbbbbbbbbbbbbbbbbbbbbbbbbbbbb","sbom":"rpm.sbom.spdx.json","sbom_sha256":"sha256:cccccccccccccccccccccccccccccccccccccccccccccccccccccccccccccccc","provenance":"rpm.sigstore.json"},{"kind":"generic-archive","file":"private-vm_0.1.0-rc.1_linux_amd64.tar.zst","size_bytes":1,"sha256":"sha256:aaaaaaaaaaaaaaaaaaaaaaaaaaaaaaaaaaaaaaaaaaaaaaaaaaaaaaaaaaaaaaaa","manifest":"generic-archive.build-manifest.json","manifest_sha256":"sha256:bbbbbbbbbbbbbbbbbbbbbbbbbbbbbbbbbbbbbbbbbbbbbbbbbbbbbbbbbbbbbbbb","sbom":"generic-archive.sbom.spdx.json","sbom_sha256":"sha256:cccccccccccccccccccccccccccccccccccccccccccccccccccccccccccccccc","provenance":"generic-archive.sigstore.json"}],"images":[{"name":"workstation-basic","repository":"ghcr.io/stevenbuglione/private-vm/workstation-basic","manifest_digest":"sha256:dddddddddddddddddddddddddddddddddddddddddddddddddddddddddddddddd"},{"name":"workstation-office","repository":"ghcr.io/stevenbuglione/private-vm/workstation-office","manifest_digest":"sha256:dddddddddddddddddddddddddddddddddddddddddddddddddddddddddddddddd"},{"name":"workstation-development","repository":"ghcr.io/stevenbuglione/private-vm/workstation-development","manifest_digest":"sha256:dddddddddddddddddddddddddddddddddddddddddddddddddddddddddddddddd"},{"name":"downloader","repository":"ghcr.io/stevenbuglione/private-vm/downloader","manifest_digest":"sha256:dddddddddddddddddddddddddddddddddddddddddddddddddddddddddddddddd"},{"name":"scanner","repository":"ghcr.io/stevenbuglione/private-vm/scanner","manifest_digest":"sha256:dddddddddddddddddddddddddddddddddddddddddddddddddddddddddddddddd"},{"name":"exporter","repository":"ghcr.io/stevenbuglione/private-vm/exporter","manifest_digest":"sha256:dddddddddddddddddddddddddddddddddddddddddddddddddddddddddddddddd"}]}
